{
  "$schema": "../../schemas/space.schema.json",
  "version": "0.2.0",
  "districts": [
    { "domainId": "dom.technical", "rect": { "min": [-50, -24], "max": [-29, 22] }, "color": "#dfe6f6" },
    { "domainId": "dom.data", "rect": { "min": [-25, -24], "max": [33, 30] }, "color": "#e6e3f7" },
    { "domainId": "dom.corpgov", "rect": { "min": [36, 10], "max": [52, 30] }, "color": "#ddefea" }
  ],
  "roads": {
    "nodes": [
      { "id": "m.w", "at": [-48, 8] },
      { "id": "m.eva", "at": [-38, 8] },
      { "id": "m.api", "at": [-34, 8] },
      { "id": "m.wj", "at": [-27, 8] },
      { "id": "m.dlt", "at": [-19.5, 8] },
      { "id": "m.landing", "at": [-14.5, 8] },
      { "id": "m.lab", "at": [-8, 8] },
      { "id": "m.bronze", "at": [-4, 8] },
      { "id": "m.mid", "at": [0.5, 8] },
      { "id": "m.sandbox", "at": [3.5, 8] },
      { "id": "m.silver", "at": [6.5, 8] },
      { "id": "m.gold", "at": [17.5, 8] },
      { "id": "m.ej", "at": [34, 8] },
      { "id": "m.e", "at": [52, 8] },

      { "id": "n.w", "at": [-48, -10] },
      { "id": "n.git", "at": [-38, -10] },
      { "id": "n.wj", "at": [-27, -10] },
      { "id": "n.trino", "at": [-11, -10] },
      { "id": "n.mid", "at": [0.5, -10] },
      { "id": "n.ceph", "at": [11, -10] },
      { "id": "n.nessie", "at": [22, -10] },
      { "id": "n.ej", "at": [34, -10] },

      { "id": "e.istok", "at": [34, 17] },
      { "id": "e.bi", "at": [34, 21] },
      { "id": "s.wj", "at": [-27, 27] },
      { "id": "s.ej", "at": [34, 27] }
    ],
    "edges": [
      ["m.w", "m.eva"], ["m.eva", "m.api"], ["m.api", "m.wj"], ["m.wj", "m.dlt"], ["m.dlt", "m.landing"], ["m.landing", "m.lab"],
      ["m.lab", "m.bronze"], ["m.bronze", "m.mid"], ["m.mid", "m.sandbox"], ["m.sandbox", "m.silver"], ["m.silver", "m.gold"],
      ["m.gold", "m.ej"], ["m.ej", "m.e"],
      ["n.w", "n.git"], ["n.git", "n.wj"], ["n.wj", "n.trino"], ["n.trino", "n.mid"], ["n.mid", "n.ceph"], ["n.ceph", "n.nessie"], ["n.nessie", "n.ej"],
      ["n.w", "m.w"], ["n.wj", "m.wj"], ["n.mid", "m.mid"], ["n.ej", "m.ej"],
      ["m.ej", "e.istok"], ["e.istok", "e.bi"], ["e.bi", "s.ej"],
      ["m.wj", "s.wj"], ["s.wj", "s.ej"]
    ]
  },
  "placements": [
    { "entityId": "sys.eva", "archetype": "opsCenter", "position": [-38, 1], "footprint": [10, 8], "port": "m.eva" },
    { "entityId": "sys.extapi", "archetype": "office", "position": [-34, 15], "footprint": [7, 5], "rotation": 2, "port": "m.api" },
    { "entityId": "sys.gitlab", "archetype": "workshop", "position": [-38, -17], "footprint": [9, 6], "port": "n.git" },

    { "entityId": "layer.landing", "archetype": "layerHall", "position": [-16, 1.5], "footprint": [8, 7], "port": "m.landing", "accent": "#8fa3c7" },
    { "entityId": "layer.bronze", "archetype": "layerHall", "position": [-5, 1.5], "footprint": [8, 7], "port": "m.bronze", "accent": "#c98a4b" },
    { "entityId": "layer.silver", "archetype": "layerHall", "position": [6.5, 1.5], "footprint": [8, 7], "port": "m.silver", "accent": "#a9b3c9" },
    { "entityId": "layer.gold", "archetype": "layerHall", "position": [17.5, 1.5], "footprint": [8, 7], "port": "m.gold", "accent": "#e2b23a" },

    { "entityId": "sys.traefik", "archetype": "gatehouse", "position": [-22.5, -4], "footprint": [3, 3] },
    { "entityId": "sys.nit", "archetype": "tower", "position": [-21, -17], "footprint": [5, 5] },
    { "entityId": "sys.trino", "archetype": "queryHub", "position": [-11, -17], "footprint": [9, 8], "port": "n.trino" },
    { "entityId": "sys.dagster", "archetype": "controlTower", "position": [0.5, -16.5], "footprint": [6, 6], "port": "n.mid" },
    { "entityId": "sys.ceph", "archetype": "silos", "position": [11, -16.5], "footprint": [10, 7], "port": "n.ceph" },
    { "entityId": "sys.nessie", "archetype": "switchyard", "position": [22, -16.5], "footprint": [8, 6], "port": "n.nessie" },
    { "entityId": "sys.observability", "archetype": "watchtower", "position": [29.5, -16.5], "footprint": [4, 4] },

    { "entityId": "sys.dlt", "archetype": "ingestDock", "position": [-19, 15], "footprint": [8, 6], "rotation": 2, "port": "m.dlt" },
    { "entityId": "sys.jupyter", "archetype": "lab", "position": [-7.5, 15.5], "footprint": [7, 6], "rotation": 2, "port": "m.lab" },
    { "entityId": "layer.sandbox", "archetype": "layerHall", "position": [3.5, 15.5], "footprint": [7, 6], "rotation": 2, "port": "m.sandbox", "accent": "#b07ee8" },
    { "entityId": "sys.infisical", "archetype": "vault", "position": [11.5, 15.5], "footprint": [5, 5], "rotation": 2 },
    { "entityId": "sys.metadata", "archetype": "archive", "position": [18.5, 15.5], "footprint": [7, 6], "rotation": 2 },
    { "entityId": "sys.istok", "archetype": "distribution", "position": [28, 17], "footprint": [12, 8], "rotation": 1, "port": "e.istok" },

    { "entityId": "sys.bi", "archetype": "office", "position": [43, 21], "footprint": [8, 6], "rotation": 3, "port": "e.bi" },

    { "entityId": "emp.data-engineer", "archetype": "employeeNode", "position": [-2.4, 21], "footprint": [1.6, 1.6] },
    { "entityId": "emp.product-owner", "archetype": "employeeNode", "position": [25, 2.5], "footprint": [1.6, 1.6] },
    { "entityId": "emp.analyst", "archetype": "employeeNode", "position": [39.5, 13.5], "footprint": [1.6, 1.6] }
  ],
  "props": [
    { "type": "tree", "at": [-48, -21] }, { "type": "tree", "at": [-46, -22] }, { "type": "tree", "at": [-31, -22] },
    { "type": "tree", "at": [-47, 20] }, { "type": "tree", "at": [-31, 20] }, { "type": "tree", "at": [-24, 22] },
    { "type": "tree", "at": [-14, 22] }, { "type": "tree", "at": [8, 22] }, { "type": "tree", "at": [15, 22] },
    { "type": "tree", "at": [-23, -22] }, { "type": "tree", "at": [-4, -22] }, { "type": "tree", "at": [17, -22] },
    { "type": "tree", "at": [31.5, -22] }, { "type": "tree", "at": [31, 3] }, { "type": "tree", "at": [50, 28] },
    { "type": "tree", "at": [37.5, 28] }, { "type": "tree", "at": [50, 12] },
    { "type": "containers", "at": [-30.5, 2] }, { "type": "containers", "at": [23.5, -4.5] },
    { "type": "containers", "at": [21.5, 25], "rotation": 1.57 },
    { "type": "tank", "at": [-45, -2] }, { "type": "tank", "at": [-45, 1] },
    { "type": "solar", "at": [-17, -21] }, { "type": "solar", "at": [44, 28] },
    { "type": "drone", "at": [26, 13] }
  ]
}
